"Full Class Name","Main Purpose/Target Site","Current Status","Key Dependencies","Extends"
"Invocation Method","Scrapers are invoked exclusively through Artisan console commands (e.g., 'legal-docs:scrape'). There is no integration with web routes, API endpoints, or the admin panel for triggering scrapes.","For better usability, add a 'Scrape Sources' button in the admin panel that dispatches ScrapeDocumentsJob for selected sources. This requires a new controller method and route."
"Queue Integration","Scraping is properly integrated with Laravel's queue system via the ScrapeDocumentsJob. This ensures scraping happens asynchronously and robustly, with configured retries and timeouts.","Keep this architecture. Consider adding a dedicated monitoring UI for queued jobs (e.g., Laravel Horizon) to improve visibility into the scraping process."
"Caching Usage","Direct usage of the Cache facade by scrapers is not found. The previous analysis mentioning caching strategies might be outdated or refer to a dependency's internal caching.","Re-evaluate the need for caching successful requests or strategies. If performance is an issue, implementing caching for scraper results or frequently accessed data could be beneficial."
"Event/Listener Integration","No custom Event/Listener integration is found for the scraping process (EventServiceProvider is missing). The system does not use events like 'ScrapingCompleted'.","Introduce events like 'ScrapingCompleted' or 'DocumentFound'. This would decouple post-scraping actions (like indexing, notifications) from the job itself, making the system more modular."
"API Endpoints","There are no API endpoints for triggering or monitoring scraping jobs.","If external systems need to trigger scrapes, create a secure, token-protected API endpoint. For now, this is not a priority as all operations are internal."
"Admin Panel Integration","The admin panel provides a CRUD interface for the 'legal_documents' table (the output of scrapers), but it completely lacks controls for initiating, scheduling, or monitoring the scraping jobs themselves.","High priority: Add a 'Scraper Management' section to the admin panel. This should list all document sources, show their status/last-scraped time, and include a button to trigger a new scrape (dispatch the job)."
"","","","",""
"Final Recommendations","","",""
"Recommendation Area","Specific Action","Justification","Priority"
"Deprecation/Removal","Remove 'FixedPeraturanScraper' from ScraperFactory.","The class file does not exist, making the factory entry dead code.","High"
"Deprecation/Removal","Deprecate and remove 'BpkScraper'.","Its functionality is subsumed by the more advanced 'TikEnhancedBpkScraper'.","Medium"
"Deprecation/Removal","Deprecate and remove 'ImprovedPeraturanScraper'.","Its functionality is subsumed by the more robust 'SessionAwarePeraturanScraper'.","Medium"
"Consolidation","Merge 'BpkScraper' features into 'TikEnhancedBpkScraper'.","Create a single, definitive scraper for peraturan.bpk.go.id.","Medium"
"Consolidation","Merge 'ImprovedPeraturanScraper' features into 'SessionAwarePeraturanScraper'.","Create a single, definitive scraper for peraturan.go.id.","Medium"
"Refactoring","Refactor 'KemenkoScraper' and 'KomdigiScraper' to extend 'BaseScraper' instead of 'KemluTikScraper'.","The current inheritance is a design flaw, linking them to an unrelated site's logic.","High"
"Testing Priority","1. KemluTikScraper, 2. JdihPerpusnasApiScraper, 3. TikEnhancedBpkScraper / SessionAwarePeraturanScraper, 4. KemenkoScraper / KomdigiScraper (post-refactor).","Test the most critical/broken scrapers first, followed by stable, then core, and finally the refactored scrapers.","High"
"Enhancement vs Replacement","Enhance: KemluTikScraper (fix & add OCR), TikEnhancedBpkScraper, SessionAwarePeraturanScraper.","These are core, advanced scrapers that form a good foundation for future work.","High"
"Enhancement vs Replacement","Replace: KemenkoScraper, KomdigiScraper, BpkScraper, ImprovedPeraturanScraper.","These scrapers are either fundamentally flawed or redundant.","Medium"
"New Functionality: Admin UI","Build an admin panel section to manage scrapers: trigger jobs, view status, and see logs.","The current system is console-only, which is a major usability gap for non-developers.","Critical"
"New Functionality: Testing","Implement a testing utility for mocking HTTP requests (e.g., PHP-VCR) and use data fixtures.","This will make tests faster, deterministic, and isolated from network/external site issues.","High"
"New Functionality: OCR","Implement the placeholder OCR API integration in 'KemluTikScraper'.","This is a key feature for extracting text from PDF documents that is currently missing.","High"
"","","","",""
"Scraper Optimization Roadmap","","",""
"Phase","Action","Details","Risk"
"1. Quick Wins","Fix KemluTikScraper, Remove dead factory entries, Register existing scrapers.","Address immediate bugs and inconsistencies for quick stability gains.","Low"
"2. Medium-Term","Refactor Kemenko/Komdigi scrapers, Consolidate BPK and Peraturan.go.id scrapers, Build Admin UI for scraping.","Improve code quality, reduce redundancy, and provide critical usability features.","Medium"
"3. Long-Term","Implement robust testing (mocking/fixtures), Introduce event-driven architecture, Implement real OCR service.","Invest in architectural improvements for long-term maintainability, scalability, and feature completeness.","High"
"Order of Operations","1. Quick Wins -> 2. Admin UI -> 3. Consolidation/Refactoring -> 4. Long-Term Architecture","Prioritize stabilizing the system, then providing user value, then major code cleanup, and finally long-term strategic changes.","N/A"
"","","","",""
"BPK Advanced Search Integration Analysis","","",""
"Area","Analysis","Recommendation"
"Target Scrapers","TikEnhancedBpkScraper is the primary candidate. BpkScraper should be deprecated, not enhanced.","Focus all new BPK-related development on the more advanced, TIK-focused scraper."
"Integration Strategy","Enhance the 'getDocumentUrls' or 'scrape' method in TikEnhancedBpkScraper to dynamically construct URLs with the new entity filters based on source configuration.","This allows for flexible and powerful searches without hardcoding URLs."
"Potential Conflicts","The new search pattern might conflict with the existing keyword-based search or category crawling. The TIK-filtering logic must be compatible with the new search results.","Design the scraper to use either the advanced search OR the existing methods, not both simultaneously. Ensure TIK scoring can be applied to results from the new endpoint."
"Implementation Complexity","Assessed as 'Medium'. Requires config changes, new URL construction logic, and potentially updated result parsing logic.","Allocate sufficient time for implementation and thorough testing to manage the complexity and avoid regressions."